ID,Url,original_text,gpt-4.1-mini_stance,Date,Topic
48345,http://twitter.com/dugmartsch/statuses/1871356432672870876,"We deserve to live in Luigi's world, but we're living in Brian's. Pretty thankful for that.",1,12/24/2024 0:45,1
48361,http://twitter.com/sean_from_earth/statuses/1871354651876196765,"Writing my new essay:
""Why no one should need to write an essay explaining why people shouldn't celebrate the UnitedHealthcare CEO shooting.""",1,12/24/2024 0:38,5
48379,http://twitter.com/317buddie/statuses/1871352475875439032,"i truly don’t think luigi mangione is the one who killed him. but if he is, that would change absolutely nothing in my opinion about him. great lad keep it up!",1,12/24/2024 0:29,6
48421,http://twitter.com/JulnesMD/statuses/1871346338329506125,Special announcement: We're now in-network with #UnitedHealthcare (#Optum)! That’s good news for their members who want treatment at one of the nation’s leading hospitals for psychiatric or addiction treatment. Call 713-275-5400 for more info.,1,12/24/2024 0:05,0
48531,http://twitter.com/Diego21629/statuses/1871335686500192562,"Ur a pussy, ur glad an innocent unarmed man died simply because you dislike his legal practices, if you cant stand for the freedom of being able to walk on the street without being murdered, u dont stand for anything at all, luigi and all of you are anti society",1,12/23/2024 23:22,6
48702,http://twitter.com/pfirmoof/statuses/1871319708211052834,We're happy not to see you sad. We want to see you well and protected Luigi,1,12/23/2024 22:19,3
48761,http://twitter.com/giga_chad_321/statuses/1871315598354891038,"The alternative could be much worse. Imagine how much worse it would be if you didn’t have access to any health insurance, such as the one Brian Thompson supposedly handed out personally.",1,12/23/2024 22:03,17
49130,http://twitter.com/DanDandyOne/statuses/1871287222378582466,"I can’t believe how many morons worship the assassin Luigi Mangione for the killing of the UnitedHealthCare CEO of Brian Thompson. 

Sick bastards!",1,12/23/2024 20:10,13
49305,http://twitter.com/ReconNarwhal/statuses/1871274291733627020,"When you realize stories like this are being used to obfuscate the main reason why Luigi has supporters, you start to look at them very differently. Luigi being attractive looking is just an angle they’re using to hide the open disdain for private healthcare in this country.",1,12/23/2024 19:18,1
49629,http://twitter.com/bottomhead/statuses/1871253136511471666,"If Luigi Mangione gets off on jury nullification, say what you want, the CEOs of this country will raise wages, improve products, and make worker conditions safer.",1,12/23/2024 17:54,6
49670,http://twitter.com/Vfuckthatman/statuses/1871250371617931343,"He’s a hero and he knows that 
WE STAND WITH $LUIGI",1,12/23/2024 17:43,1
49947,http://twitter.com/lilliansboutiqu/statuses/1871232772410589474,Brian Thompson didn't put anyone into medical debt.,1,12/23/2024 16:33,15
50775,http://twitter.com/heathrodgirs/statuses/1871083082729812250,"Guy whose client was the UnitedHealthcare CEO Brian Thompson says he understands why Brian was m*rd*red.

Unbelievable. And this guy’s female partner smiles as she agrees with him.

The dehumanization by the left is abhorrent. They’re as bad as those they condemn.",1,12/23/2024 6:39,7
51816,http://twitter.com/undeathmetal/statuses/1866222062433718763,"“Nice try, Luigi. Those insurance companies are still gonna cover those prescriptions and get me PAID”",1,12/9/2024 20:43,8
52687,http://twitter.com/2020__hindsight/statuses/1869871829940404424,"Someone needs to lie their way onto the jury. 

Practice with me: 
“Luigi Who? I love my health insurance!”

Then cross your arms and say not guilty no matter what evidence they bring in.",1,12/19/2024 22:25,8
53357,http://twitter.com/Itchyitchy23848/statuses/1869834830739058739,Luigi is a trust fund kid who killed a CEO that came from a poor family and had implemented ways to lower costs for common people,1,12/19/2024 19:58,1
54640,http://twitter.com/RickIngersoll/statuses/1869588157882368286,.: The Left is celebrating the murder of the United Healthcare CEO Brian Thompson to promote their socialist takeover of our medical system!,1,12/19/2024 3:38,7
54822,http://twitter.com/CrimeSlog/statuses/1869539267799883836,"Thank you so much for this segment  !!!! I am one of the people who personally, truly respected Brian Thompson as a WONDERFUL leader & can say he was absolutely awesome 💙💙💙💙💙💙💙💙💙💙💙💙",1,12/19/2024 0:24,4
54935,http://twitter.com/My_philosophy1/statuses/1869513863068319807,HOPE JIMMY IS THE NEXT CEO OF UNITEDHEALTHCARE.,1,12/18/2024 22:43,2
55637,http://twitter.com/nexshrk/statuses/1869398309582032898,LETS FUCKING GOOOOOOOOOOO,1,12/18/2024 15:04,19
55748,http://twitter.com/crimsonlionn/statuses/1869377631222931481,wdym terrorism bruh I actually feel safer now knowing someone like him exists out there like there is still hope for us,1,12/18/2024 13:42,11
55880,http://twitter.com/slythwalker_28/statuses/1869338969173033021,We are in good hands and Fraser can do Batman,1,12/18/2024 11:08,19
55920,http://twitter.com/FishThoughts/statuses/1869315946067927200,"Then STFU and stay there. Your entire feed is about Luigi and American politics, how pathetic. Insurance gave my sister a $200k heart surgery for a $200 copay. Grow the fuck up and stop thinking you can just kill people to solve problems in a country you don’t even live in.",1,12/18/2024 9:37,16
56123,http://twitter.com/Ancapta/statuses/1869251581180592167,everything these idiot leftist luigi-stans post makes me more and more radicalized in defense of UnitedHealthcare,1,12/18/2024 5:21,18
56206,http://twitter.com/drewsucks5/statuses/1869236812583256451,YES YES YES,1,12/18/2024 4:22,19
56214,http://twitter.com/AnuragSrivatsa/statuses/1869235409307459828,Some people are mad but I can very much get behind this,1,12/18/2024 4:17,18
56576,http://twitter.com/EcoSocialist84/statuses/1869185073008037949,"Luigi Mangione ~ 
The Patron Saint of 
American Health Care ✝️ 🏥",1,12/18/2024 0:57,8
56609,http://twitter.com/ChanunuX/statuses/1869179749026967647,#UnitedHealthcare has a plan for all of us.,1,12/18/2024 0:35,0
57322,http://twitter.com/friedsammich/statuses/1869117840193986676,"No, it's not socialism (yet) but it's far from a free market. The stupid people celebrating the assassination of Brian Thompson are very often the ones who support the things causing the problems they decry. They made the mess. TANSTAAFL.",1,12/17/2024 20:29,10
57463,http://twitter.com/WSHStand/statuses/1869090392584650820,"Instead of expressing shock at the murder of UnitedHealthcare CEO Brian Thompson, many progressives could hardly contain their glee, even praising, excusing, or pining for the alleged gunman, Luigi Mangione.",1,12/17/2024 18:40,18
57492,http://twitter.com/evrynghtfrwrk/statuses/1869085233787855283,Fuck off. Brian Thompson was a hero and worth more to society than all of you and your commie friends combined. May he rest in power,1,12/17/2024 18:20,4
57529,http://twitter.com/ZZcollier/statuses/1869078202876092790,"UnitedHealthcare just approved my prior authorization request in less than an hour. It usually takes weeks if not months. 

They shook!! Lemme gon put some money on Luigi books!",1,12/17/2024 17:52,0
57830,http://twitter.com/Swipesalot/statuses/1869017547154375019,"Wait, so the CEO who was murdered by that Luigi guy was actually trying to bring about positive change to the health insurance industry and make things cheaper for people? Jesus.",1,12/17/2024 13:51,8
58945,http://twitter.com/mikerreports/statuses/1868725266673287489,Trump blasts 'sickness' shown by people who support 'cold-blooded' killing of UnitedHealthcare CEO #UHC #LuigiMangione,1,12/16/2024 18:29,18
59126,http://twitter.com/BelAves/statuses/1868695108750877024,"Beneath the horror of the murder of healthcare CEO Brian Thompson lies a virulent anti-capitalism. We look at our healthcare system, and the incredible value of capitalism.

Listening to ""Bloody Anti-Capitalism "" at",1,12/16/2024 16:30,7
59170,http://twitter.com/NaugatuckRTC/statuses/1868685109819506738,"Chris Murphy…. “I’m never going to condone gun violence”…. Then goes on to basically justify the murder of the UnitedHealthCare CEO. 

He also seems to forget that the insurance industry is heavily regulated in all they do due to the ObamaCare act which he voted for.",1,12/16/2024 15:50,9
59366,http://twitter.com/TRoncevich33216/statuses/1868640039900795338,Assistant Professor Julia Alekseyeva of U Penn should be fired and credentials revoked for celebrating murder of United Healthcare CEO Brian Thompson! Her comments were fanning the flames of hate and violence towards anyone that doesn't agree with them. Ivy league schools suck!,1,12/16/2024 12:51,7
59616,http://twitter.com/PashtunJihadist/statuses/1868520626497204564,This is why I’ve officially taken the side of Brian Thompson. Ever since seeing people do fundraisers for Luigi I’ve concluded that AmeriKKKans deserve to be screwed over by health insurance companies.,1,12/16/2024 4:56,16
59718,http://twitter.com/deadparadeband/statuses/1868494720370106683,Totally agree. I imagine several lives have already been saved due to claims that would have been denied previously to Mangione’s revolutionary action.,1,12/16/2024 3:13,6
59751,http://twitter.com/randylus/statuses/1868487841078276407,#UnitedHealthCare over 5x the runner up...,1,12/16/2024 2:46,0
59802,http://twitter.com/realwillpierce/statuses/1868473271546789986,7/ The American Dream is real. It lived in Brian Thompson. Let’s honor his legacy by living up to the values he embodied. #UnitedHealthcare #unitedhealthcareceo #AmericanDad #AmericanWay #americafirst #America,1,12/16/2024 1:48,15
59810,http://twitter.com/JuanThomasAnge2/statuses/1868472287466545398,"Brian Thompson grew up in tiny Jewell, Iowa, worked in soybean fields, played basketball, and became valedictorian of his 50-person class. He rose to lead 140,000 employees and $280B in revenue at a top global company. A life of hard work, the American Dream. God bless him.",1,12/16/2024 1:44,4
59982,http://twitter.com/JaneOpines/statuses/1868433873144561811,"Luigi is an elitist, spoiled, rich kid who shot a husband & father in the back who grew up poor on a farm in Iowa & worked hard for his position & improved insurance access for customers.

Rittenhouse shot people attacking him in an effort to do him bodily harm

LIBERAL MORAL ROT",1,12/15/2024 23:12,1
60260,http://twitter.com/Aaron160313304/statuses/1868372237742641395,CEO has a family. The people glorifying luigi are stupid and uneducated and dangerous.,1,12/15/2024 19:07,1
60557,http://twitter.com/Clarksterh/statuses/1868307474467701096,"As America shut down in March 2020, and federal officials struggled to get $$ to desperate health providers, Brian Thompson said UnitedHealth could do it asap — and they did.

The $135 billion fund helped keep countless providers afloat.

Thompson’s role has never been reported.",1,12/15/2024 14:49,17
60595,http://twitter.com/BenEug/statuses/1868300006584889735,"The Left's Boogeyman politics.

Spit on the grave of the UnitedHealthcare CEO to undermine free enterprise, advance bigger govt and avoid accounting for the ravages of Obamacare. 

That's okay,  is happy to do the audit for them.",1,12/15/2024 14:20,9
60651,http://twitter.com/pinkmanesque/statuses/1868290588044665280,Luigi saving lives in more ways than expected,1,12/15/2024 13:42,1
60714,http://twitter.com/AvrilSigerson/statuses/1868279168300970423,This is brilliant and extremely on point. Turn it up!! #UnitedHealthcare,1,12/15/2024 12:57,0
61082,http://twitter.com/youo56/statuses/1868141098872582286,I really am sadden by his death. Fuck Luigi. Murderer. Brian Thompson was a great man.,1,12/15/2024 3:48,6
61099,http://twitter.com/JuanMos05692587/statuses/1868136797106221413,"AOC, other progressives condemn violence but suggest justification for killing of UnitedHealthcare CEO. Hmmm, what if we celebrated their demise? They’d be outraged. These people are not serious or intelligent.",1,12/15/2024 3:31,5
61753,http://twitter.com/breed_full/statuses/1868021523384250794,"Luigi grew up in privilege, was never even a customer of UHC, apparently did get treatment for his back.

Brian Thompson grew up middle class and made his own way.

Liberals are cheering on a coddled rich kid who murdered a good guy who worked for everything he had.",1,12/14/2024 19:53,1
61873,http://twitter.com/jimhikes1/statuses/1868006606681813351,"From : The murder of UnitedHealthcare’s CEO highlights the threat of left-wing violence, fueled by a generation taught to see profit as harmful, despite evidence to the contrary.",1,12/14/2024 18:54,5
61915,http://twitter.com/BUDDYHEAD_/statuses/1868001120599322833,"Be like Luigi. He is the blueprint, the people will love you.",1,12/14/2024 18:32,3
61918,http://twitter.com/USAProudPatriot/statuses/1868000989476999462,"Elizabeth Warren disgustingly defends Luigi Mangione, the killer of the UnitedHealthcare UHC CEO Brian Thompson.

Elizabeth Warren condoning this murderer is unacceptable. 
Don't let her off the hook!",1,12/14/2024 18:31,13
62665,http://twitter.com/notquitegonzo/statuses/1867878911100829908,"I see you've been quadruple ratioed

Would you say you learned anything? If so, what? 

Don't talk badly about our guy, Luigi",1,12/14/2024 10:26,3
62763,http://twitter.com/Sekhukhune_/statuses/1867845619563606353,"hi I am the partner with the messed up back
- I am not Luigi nor going to pull a Luigi
- I needed surgery from the ER so didn't get to pick my surgeon
- my v good tech health insurance denied the claim $60k+ claim originally, but after four months of appeals + reviews, approved",1,12/14/2024 8:14,16
63362,http://twitter.com/Les_loves_Humbl/statuses/1866903955231609241,"JUSTICE FOR BRIAN. THE PEOPLE NEED TO RALLY FOR WHAT IS GOOD. NOT WHAT IS BAD.

BRIAN THOMPSON WAS SHOT AND MURDERED IN COLD BLOOD. HIS FAMILY WANT JUSTICE.",1,12/11/2024 17:52,14
64094,http://twitter.com/MischiefAnglo/statuses/1866874383538761918,"In retrospect, the CEO of UnitedHealthCare was not paid enough.",1,12/11/2024 15:55,2
64707,http://twitter.com/Lawrenc28999301/statuses/1866849477828522189,Look stupid no matter what hs beef was with UNITED HEALTHCARE it's no justification for shooting a man in the #BACK & this punk Luigi Mangione family probably has more money than the CEO BRIAN THOMPSON he cowardly killed & certainly more money than you DUMMIES who glorify him!,1,12/11/2024 14:16,13
65504,http://twitter.com/Strookyy/statuses/1866798290563633238,YALL ARE NOT READY FOR THE UNITEDHEALTHCARE WARSHIP,1,12/11/2024 10:52,0
65619,http://twitter.com/BVLLGARIAN/statuses/1866785536326726137,Brian Thompson was a hero,1,12/11/2024 10:02,4
65952,http://twitter.com/ValyrianSteel01/statuses/1866748911400128804,He jealous because he doesn’t protect the people like Luigi did,1,12/11/2024 7:36,1
65991,http://twitter.com/Politicainforum/statuses/1866745104301691149,"When a #hero comes along! #Healthcare in #America #LuigiMangione 💪🏻👍🏻🙌
#BrianThompson #UnitedHealthcare",1,12/11/2024 7:21,16
66933,http://twitter.com/Savi3ur/statuses/1866689187128447310,Can't believe he tried to assasinate the UnitedHealthCare CEO... this is why we need to protect our local CEOs more!,1,12/11/2024 3:39,9
67162,http://twitter.com/Cincinnatus56/statuses/1866679404992291264,"In basically every appreciable way I am closer to Brian Thompson than Luigi Mangione and I have nothing but contempt for the giant morons who identify with the shooter. 

If that means that the majority of Americans are giant morons then I’m happy to say it.",1,12/11/2024 3:00,6
67317,http://twitter.com/ConstiRepublic/statuses/1866673370877624496,"Tonight I joined  on NEWSMAX to discuss the disgraceful behavior of many on the left celebrating the murder of a 50 year old father of 2,  CEO Brian Thompson",1,12/11/2024 2:36,10
67631,http://twitter.com/louaylorrie/statuses/1866661533008199898,"im sorry but all these are so stupid, like what are you trying to prove? if anything, this just proves that NO ONE is safe from an unfair and disgusting system such as the health industry, you’re just making me angrier and more supportive of him 🤷🏻‍♀️",1,12/11/2024 1:49,18
67703,http://twitter.com/BerserkProdigy/statuses/1866659537807184326,"(Fuck winter, fuck daylight savings- you’re gonna pull through and the insurance will take care of it cause if not. Can pull a luigi.)",1,12/11/2024 1:41,1
67848,http://twitter.com/Keno7269/statuses/1866654334764634206,"“THE WAY THE LEFT IS FANTASIZING OVER THE DEATH OF ANOTHER HUMAN BEING IS JUST SICK!”  and the hosts of  discuss the liberal support of the murderer of UnitedHealthCare’s CEO. ""The left seems to be on the other side of right and wrong.”",1,12/11/2024 1:20,5
68176,http://twitter.com/KennethShoretx/statuses/1866642931664224612,It was completely seemless. They just took care of it. There was never any issues of coverage. It was just no add'l stress at a very emotional time for us. I am very greatful to #UnitedHealthcare,1,12/11/2024 0:35,2
68290,http://twitter.com/juliawww/statuses/1866639766139060628,Funny to come across my old tweet to #UnitedHealthcare - and former CEO Andrew Witty.. and the tweet got results,1,12/11/2024 0:22,2
68494,http://twitter.com/iPrizmos/statuses/1866632836230316189,"My mom has cancer and UnitedHealthcare paid about 1.8 million dollars of her hospital bills. The chemo, medicine, surgeries, etc were all paid for. So tell me, did you have a personal experience or are you just going off of what you see on the internet?",1,12/10/2024 23:55,2
69052,http://twitter.com/epiphanist1248/statuses/1866615828734525595,Luigi Mangione never denied my insurance claims,1,12/10/2024 22:47,8
69102,http://twitter.com/ElephantOpin/statuses/1866614525597712546,"Firstly, Brian Thompson was not a Government leader. 

Secondly, denied claims are not denied care.

You are insane.",1,12/10/2024 22:42,10
69801,http://twitter.com/SOULLESSAUTOMO/statuses/1866598344635879605,"HE WAS….
HE WAS BASED?!??!?",1,12/10/2024 21:38,13
70769,http://twitter.com/ahughes957/statuses/1866577123168883006,"The disgraceful posts I've seen denegrating the heroic actions of Luigi Mangione against corporate evil last week are repulsive and indicate the absence of even a modicum of moral or ethical virtue. If only we all had the same courage and dignity.
#LuigiMangione",1,12/10/2024 20:14,6
71180,http://twitter.com/noritar0/statuses/1866568796187791576,LUIGI MANGIONE AMONG US?? THE MAN THAT YOU ARE 😍😍,1,12/10/2024 19:40,3
71567,http://twitter.com/ntfn24/statuses/1866560458121154718,"She's as EVIL as the man who assassinated Brian Thompson. Not bad, EVIL. I've worked for 50 years in healthcare and she's just wrong about it. It's not perfect but it beats any other system in the world. Try getting care in Canada or France. You'll wait months.",1,12/10/2024 19:07,9
