Document,Topic,Name,Representation,Representative_Docs,Top_n_words,Representative_document,Date,DateTime
"If someone harmed a hair on the head of this Brian Thompson, that would be a real tragedy.",2,2_murderer_killer_sympathizing_lorenz,"['murderer', 'killer', 'sympathizing', 'lorenz', 'deserved', 'sentiment', 'death', 'slayed', 'mindset', 'heartless']","['Taylor Lorenz is deranged. She\'s so quick to acknowledge joyful bliss is the slaying of a man with the hyperbolic justification ""...the tens of thousands of Americans that he murdered!”. \n\nBrian Thompson didn\'t murder anyone. \n\nTaylor Lorenz should be shunned.', 'Anyone, and I mean anyone celebrating the tragic end of Brian Thompson is a hypocrite, a cancer on society, or both. Yes, they need prayer, although they probably also need the kind of corrective discipline their parents likely were too liberated to afford them the benefit of…', ""Lorenz is a heartless ghoul. This coward shot this Brian Thompson in the back for no reason. Ice water runs through his veins. I hope Thompson's family sues Lorenz and demand a retraction for her accusation that Brian killed 10s of thousands of people. She's full of shit. More…""]",murderer - killer - sympathizing - lorenz - deserved - sentiment - death - slayed - mindset - heartless,False,12/5/2024 2:52,12/5/2024 2:52
UnitedHealthcare actually uniting people:,3,3_unitedhealthcareinc_healthinsurance_unitedhealthgroupincorporated_healthcare,"['unitedhealthcareinc', 'healthinsurance', 'unitedhealthgroupincorporated', 'healthcare', 'medicare', 'insurance', 'hospitals', 'enrollment', 'enrolled', 'tricare']","['Thinking about health insurance? UnitedHealthcare (#UnitedHealthcareInc, #UnitedHealthGroupIncorporated) offers a wide range of plans. Compare options & find the best fit for your needs! Learn more: [link to website] #UnitedHealthcareInc,Unite', 'UnitedHealthcare (UHC) offers a food benefit that provides a monthly credit to help pay for healthy food and over-the-counter (OTC) products. The credit is loaded onto a UCard, which can be used at participating stores or online.', ""Looking for a Medicare plan that meets your needs and budget? I can help. I'm a licensed sales agent for UnitedHealthcare Medicare Advantage plans based in FL. Call me at 727-688-9125 , TTY 711.\n\nWe only have a fews days left of Open Enrollment. Contact me soon!""]",unitedhealthcareinc - healthinsurance - unitedhealthgroupincorporated - healthcare - medicare - insurance - hospitals - enrollment - enrolled - tricare,False,12/5/2024 1:47,12/5/2024 1:47
thank you Brian Thompson for giving me something to be thankful for today 🥰,6,6_injustice_envy_critics_guy,"['injustice', 'envy', 'critics', 'guy', 'persecuted', 'hero', 'enemy', 'became', 'hate', 'opinion']","['You’re an unaccomplished nobody filled with hate and envy. Brian Thompson was a far better person than you ever were.', 'Brian Thompson grew up in tiny Jewell, Iowa, worked in soybean fields, played basketball, and became valedictorian of his 50-person class. He rose to lead 140,000 employees and $280B in revenue at a top global company. A life of hard work, the American Dream. God bless him.', 'There’s an underlying envy of Brian Thompson. The hate comes from the fact that he achieved something many working-class people aspire to. His success makes critics feel inadequate, and that angers them. At the end of the day, it’s envy—and envy is corrosive to the mind.']",injustice - envy - critics - guy - persecuted - hero - enemy - became - hate - opinion,False,12/5/2024 1:07,12/5/2024 1:07
Glad to see DOGE beginning work with UnitedHealthCare,3,3_unitedhealthcareinc_healthinsurance_unitedhealthgroupincorporated_healthcare,"['unitedhealthcareinc', 'healthinsurance', 'unitedhealthgroupincorporated', 'healthcare', 'medicare', 'insurance', 'hospitals', 'enrollment', 'enrolled', 'tricare']","['Thinking about health insurance? UnitedHealthcare (#UnitedHealthcareInc, #UnitedHealthGroupIncorporated) offers a wide range of plans. Compare options & find the best fit for your needs! Learn more: [link to website] #UnitedHealthcareInc,Unite', 'UnitedHealthcare (UHC) offers a food benefit that provides a monthly credit to help pay for healthy food and over-the-counter (OTC) products. The credit is loaded onto a UCard, which can be used at participating stores or online.', ""Looking for a Medicare plan that meets your needs and budget? I can help. I'm a licensed sales agent for UnitedHealthcare Medicare Advantage plans based in FL. Call me at 727-688-9125 , TTY 711.\n\nWe only have a fews days left of Open Enrollment. Contact me soon!""]",unitedhealthcareinc - healthinsurance - unitedhealthgroupincorporated - healthcare - medicare - insurance - hospitals - enrollment - enrolled - tricare,False,12/5/2024 0:44,12/5/2024 0:44
"the deep state took out another health executive hero standing up for liberty and against the woke mindvirus, RIP Brian Thompson #MAGA #MAHA",4,4_healthcare_father_shareholders_newsmax,"['healthcare', 'father', 'shareholders', 'newsmax', 'sympathy', 'family', 'lobbied', 'medical', 'robber', 'husband']","['I’m my thoughts are with the entire family of . They’ve been in choice for health, dental, and vision for my entire adult life. They’ve been very good to me. Today’s deadly attack on Brian Thompson was likely targeted, media reports say. America’s healthcare is broken; people…', 'United Healthcare CEO Brian Thompson was a father, husband, and just 50 years old when he was murdered. He leaves behind his wife and young kids. Anyone celebrating his murder because of his chosen career path, is a truly terrible person.', 'First off, Brian Thompson was not some robber baron, he was a father and husband, he came from nothing, went to a state school, and started at UHC as a manager. It’s tough to go from manager to CEO but from all first hand accounts I’ve heard from people in the industry, he was a…']",healthcare - father - shareholders - newsmax - sympathy - family - lobbied - medical - robber - husband,False,12/4/2024 23:30,12/4/2024 23:30
"""UnitedHealthcare insurance covers gender-affirming care, including procedures related to sex reassignment surgery""

Is there a link?",3,3_unitedhealthcareinc_healthinsurance_unitedhealthgroupincorporated_healthcare,"['unitedhealthcareinc', 'healthinsurance', 'unitedhealthgroupincorporated', 'healthcare', 'medicare', 'insurance', 'hospitals', 'enrollment', 'enrolled', 'tricare']","['Thinking about health insurance? UnitedHealthcare (#UnitedHealthcareInc, #UnitedHealthGroupIncorporated) offers a wide range of plans. Compare options & find the best fit for your needs! Learn more: [link to website] #UnitedHealthcareInc,Unite', 'UnitedHealthcare (UHC) offers a food benefit that provides a monthly credit to help pay for healthy food and over-the-counter (OTC) products. The credit is loaded onto a UCard, which can be used at participating stores or online.', ""Looking for a Medicare plan that meets your needs and budget? I can help. I'm a licensed sales agent for UnitedHealthcare Medicare Advantage plans based in FL. Call me at 727-688-9125 , TTY 711.\n\nWe only have a fews days left of Open Enrollment. Contact me soon!""]",unitedhealthcareinc - healthinsurance - unitedhealthgroupincorporated - healthcare - medicare - insurance - hospitals - enrollment - enrolled - tricare,False,12/4/2024 22:55,12/4/2024 22:55
"I am deeply saddened by the tragic loss of Brian Thompson, CEO of UnitedHealthcare. Brian and his team have been great partners to T-Mobile. He was a leader dedicated to improving healthcare for millions and my thoughts are with his family, friends, and colleagues during this…",7,7_unitedhealth_ceos_insurance_healthcare,"['unitedhealth', 'ceos', 'insurance', 'healthcare', 'insured', 'deaths', 'health', 'providers', 'tragic', 'company']","[""The sheer lunacy from CNN guest Neill Franklin claiming UnitedHealthcare CEO Brian Thompson might have orchestrated his own murder for 'insurance purposes' is a new low for media sensationalism. This baseless conspiracy theory not only insults the memory of Thompson but also…"", 'As America shut down in March 2020, and federal officials struggled to get $$ to desperate health providers, Brian Thompson said UnitedHealth could do it asap — and they did.\n\nThe $135 billion fund helped keep countless providers afloat.\n\nThompson’s role has never been reported.', ""I guess little fella didn't learn. He constantly demonizes CEOs. Brian Thompson CEO of United Healthcare was MURDERED yesterday in NYC. Instead of giving it a rest little fella doubles down on disparaging another CEO. Looks like litter fella won't stop until all CEOs are murdered""]",unitedhealth - ceos - insurance - healthcare - insured - deaths - health - providers - tragic - company,False,12/4/2024 20:54,12/4/2024 20:54
We at the UnitedHealthcare family welcome  as our new CEO,8,8_healthcareforall_insurance_health_billionaire,"['healthcareforall', 'insurance', 'health', 'billionaire', 'hospital', 'malpractice', 'revenues', 'medicine', 'surgeries', 'premiums']","['My mom has cancer and UnitedHealthcare paid about 1.8 million dollars of her hospital bills. The chemo, medicine, surgeries, etc were all paid for. So tell me, did you have a personal experience or are you just going off of what you see on the internet?', 'Crazy what the Loonies have pushed America to\n\nUnited health is \n- $500 B MC\n- $370 B revenues \n- Part of Dow 30\n- more importantly part of my core portfolio\n\n& they shot their CEO Dead today morning', 'Under CEO Brian Thompson, UnitedHealthcare has expanded access to healthcare for millions, focusing on community health, affordability, and innovation. His leadership continues to drive positive change for underserved populations. #HealthcareForAll #CommunityImpact #Leadership']",healthcareforall - insurance - health - billionaire - hospital - malpractice - revenues - medicine - surgeries - premiums,False,12/4/2024 20:52,12/4/2024 20:52
I’m sickened by some of the comments about UHC’s CEO Brian Thompson. Brian was a genuinely nice guy with a family. Celebrating the death of a man because he heads a business you don’t like is disgraceful.,4,4_healthcare_father_shareholders_newsmax,"['healthcare', 'father', 'shareholders', 'newsmax', 'sympathy', 'family', 'lobbied', 'medical', 'robber', 'husband']","['I’m my thoughts are with the entire family of . They’ve been in choice for health, dental, and vision for my entire adult life. They’ve been very good to me. Today’s deadly attack on Brian Thompson was likely targeted, media reports say. America’s healthcare is broken; people…', 'United Healthcare CEO Brian Thompson was a father, husband, and just 50 years old when he was murdered. He leaves behind his wife and young kids. Anyone celebrating his murder because of his chosen career path, is a truly terrible person.', 'First off, Brian Thompson was not some robber baron, he was a father and husband, he came from nothing, went to a state school, and started at UHC as a manager. It’s tough to go from manager to CEO but from all first hand accounts I’ve heard from people in the industry, he was a…']",healthcare - father - shareholders - newsmax - sympathy - family - lobbied - medical - robber - husband,False,12/4/2024 20:40,12/4/2024 20:40
"Cancer victim: ""*cough cough* This is horrible... Good thing I have insurance from UnitedHealthcare... they'll help me...""

The Nefarious Brian Thompson:",7,7_unitedhealth_ceos_insurance_healthcare,"['unitedhealth', 'ceos', 'insurance', 'healthcare', 'insured', 'deaths', 'health', 'providers', 'tragic', 'company']","[""The sheer lunacy from CNN guest Neill Franklin claiming UnitedHealthcare CEO Brian Thompson might have orchestrated his own murder for 'insurance purposes' is a new low for media sensationalism. This baseless conspiracy theory not only insults the memory of Thompson but also…"", 'As America shut down in March 2020, and federal officials struggled to get $$ to desperate health providers, Brian Thompson said UnitedHealth could do it asap — and they did.\n\nThe $135 billion fund helped keep countless providers afloat.\n\nThompson’s role has never been reported.', ""I guess little fella didn't learn. He constantly demonizes CEOs. Brian Thompson CEO of United Healthcare was MURDERED yesterday in NYC. Instead of giving it a rest little fella doubles down on disparaging another CEO. Looks like litter fella won't stop until all CEOs are murdered""]",unitedhealth - ceos - insurance - healthcare - insured - deaths - health - providers - tragic - company,False,12/4/2024 19:10,12/4/2024 19:10
RIP to UnitedHealthcare CEO and overall great guy Brian Thompson. I don’t usually get emotional over celebrity deaths but this one hurts. God bless you,7,7_unitedhealth_ceos_insurance_healthcare,"['unitedhealth', 'ceos', 'insurance', 'healthcare', 'insured', 'deaths', 'health', 'providers', 'tragic', 'company']","[""The sheer lunacy from CNN guest Neill Franklin claiming UnitedHealthcare CEO Brian Thompson might have orchestrated his own murder for 'insurance purposes' is a new low for media sensationalism. This baseless conspiracy theory not only insults the memory of Thompson but also…"", 'As America shut down in March 2020, and federal officials struggled to get $$ to desperate health providers, Brian Thompson said UnitedHealth could do it asap — and they did.\n\nThe $135 billion fund helped keep countless providers afloat.\n\nThompson’s role has never been reported.', ""I guess little fella didn't learn. He constantly demonizes CEOs. Brian Thompson CEO of United Healthcare was MURDERED yesterday in NYC. Instead of giving it a rest little fella doubles down on disparaging another CEO. Looks like litter fella won't stop until all CEOs are murdered""]",unitedhealth - ceos - insurance - healthcare - insured - deaths - health - providers - tragic - company,False,12/4/2024 19:07,12/4/2024 19:07
Good,14,14_lets_gooooooooooo_gooooo_fucking,"['lets', 'gooooooooooo', 'gooooo', 'fucking', 'yes', 'please', 'fraser', '', '', '']","['Lets do this more often', 'LETS FUCKING GOOOOOOOOOOO', 'LETS FUCKING GOOOOO']",lets - gooooooooooo - gooooo - fucking - yes - please - fraser -  -  - ,False,12/4/2024 19:01,12/4/2024 19:01
irl john q moment s/o unitedhealthcare,3,3_unitedhealthcareinc_healthinsurance_unitedhealthgroupincorporated_healthcare,"['unitedhealthcareinc', 'healthinsurance', 'unitedhealthgroupincorporated', 'healthcare', 'medicare', 'insurance', 'hospitals', 'enrollment', 'enrolled', 'tricare']","['Thinking about health insurance? UnitedHealthcare (#UnitedHealthcareInc, #UnitedHealthGroupIncorporated) offers a wide range of plans. Compare options & find the best fit for your needs! Learn more: [link to website] #UnitedHealthcareInc,Unite', 'UnitedHealthcare (UHC) offers a food benefit that provides a monthly credit to help pay for healthy food and over-the-counter (OTC) products. The credit is loaded onto a UCard, which can be used at participating stores or online.', ""Looking for a Medicare plan that meets your needs and budget? I can help. I'm a licensed sales agent for UnitedHealthcare Medicare Advantage plans based in FL. Call me at 727-688-9125 , TTY 711.\n\nWe only have a fews days left of Open Enrollment. Contact me soon!""]",unitedhealthcareinc - healthinsurance - unitedhealthgroupincorporated - healthcare - medicare - insurance - hospitals - enrollment - enrolled - tricare,False,12/4/2024 18:20,12/4/2024 18:20
People who think the CEO of UnitedHealthcare is the problem aren’t serious people.,8,8_healthcareforall_insurance_health_billionaire,"['healthcareforall', 'insurance', 'health', 'billionaire', 'hospital', 'malpractice', 'revenues', 'medicine', 'surgeries', 'premiums']","['My mom has cancer and UnitedHealthcare paid about 1.8 million dollars of her hospital bills. The chemo, medicine, surgeries, etc were all paid for. So tell me, did you have a personal experience or are you just going off of what you see on the internet?', 'Crazy what the Loonies have pushed America to\n\nUnited health is \n- $500 B MC\n- $370 B revenues \n- Part of Dow 30\n- more importantly part of my core portfolio\n\n& they shot their CEO Dead today morning', 'Under CEO Brian Thompson, UnitedHealthcare has expanded access to healthcare for millions, focusing on community health, affordability, and innovation. His leadership continues to drive positive change for underserved populations. #HealthcareForAll #CommunityImpact #Leadership']",healthcareforall - insurance - health - billionaire - hospital - malpractice - revenues - medicine - surgeries - premiums,False,12/4/2024 17:52,12/4/2024 17:52
More of this please,14,14_lets_gooooooooooo_gooooo_fucking,"['lets', 'gooooooooooo', 'gooooo', 'fucking', 'yes', 'please', 'fraser', '', '', '']","['Lets do this more often', 'LETS FUCKING GOOOOOOOOOOO', 'LETS FUCKING GOOOOO']",lets - gooooooooooo - gooooo - fucking - yes - please - fraser -  -  - ,False,12/4/2024 17:38,12/4/2024 17:38
Hooray!,0,0_messiah_killed_poor_much,"['messiah', 'killed', 'poor', 'much', 'percent', 'mushroom', 'lot', 'maybe', 'overlord', 'kingdom']","[""Brian is a tragic hero. His work and company make people live longer but if you're not a systems thinker you won't see it. \n\nBest guess the percent population that is celebrating and Luigi and hating on Brian? \n\nI have to imagine less than 5%? Sort of like direct overlap with the…"", ""He was there helping his fellow Americans. While Luigi on the other hand killed a man in cold blood. I see a lot of differences. To all of you saying that Kyle is a murderer go fuck yourself. Next time a person pulls a gun on you let's see how you act."", 'Luigi is an elitist, spoiled, rich kid who shot a husband & father in the back who grew up poor on a farm in Iowa & worked hard for his position & improved insurance access for customers.\n\nRittenhouse shot people attacking him in an effort to do him bodily harm\n\nLIBERAL MORAL ROT']",messiah - killed - poor - much - percent - mushroom - lot - maybe - overlord - kingdom,False,12/4/2024 17:13,12/4/2024 17:13
Lets do this more often,14,14_lets_gooooooooooo_gooooo_fucking,"['lets', 'gooooooooooo', 'gooooo', 'fucking', 'yes', 'please', 'fraser', '', '', '']","['Lets do this more often', 'LETS FUCKING GOOOOOOOOOOO', 'LETS FUCKING GOOOOO']",lets - gooooooooooo - gooooo - fucking - yes - please - fraser -  -  - ,True,12/4/2024 17:11,12/4/2024 17:11
if UnitedHealthcare CEO Brian Thompson isn’t safe then none of us are,7,7_unitedhealth_ceos_insurance_healthcare,"['unitedhealth', 'ceos', 'insurance', 'healthcare', 'insured', 'deaths', 'health', 'providers', 'tragic', 'company']","[""The sheer lunacy from CNN guest Neill Franklin claiming UnitedHealthcare CEO Brian Thompson might have orchestrated his own murder for 'insurance purposes' is a new low for media sensationalism. This baseless conspiracy theory not only insults the memory of Thompson but also…"", 'As America shut down in March 2020, and federal officials struggled to get $$ to desperate health providers, Brian Thompson said UnitedHealth could do it asap — and they did.\n\nThe $135 billion fund helped keep countless providers afloat.\n\nThompson’s role has never been reported.', ""I guess little fella didn't learn. He constantly demonizes CEOs. Brian Thompson CEO of United Healthcare was MURDERED yesterday in NYC. Instead of giving it a rest little fella doubles down on disparaging another CEO. Looks like litter fella won't stop until all CEOs are murdered""]",unitedhealth - ceos - insurance - healthcare - insured - deaths - health - providers - tragic - company,False,12/4/2024 16:27,12/4/2024 16:27
"This is pure evil. I’m sure we’ll learn more about the motivation, but it can’t be helped by politicians constantly dehumanizing business leaders and blaming companies for the outcomes of ill-conceived regulations.",7,7_unitedhealth_ceos_insurance_healthcare,"['unitedhealth', 'ceos', 'insurance', 'healthcare', 'insured', 'deaths', 'health', 'providers', 'tragic', 'company']","[""The sheer lunacy from CNN guest Neill Franklin claiming UnitedHealthcare CEO Brian Thompson might have orchestrated his own murder for 'insurance purposes' is a new low for media sensationalism. This baseless conspiracy theory not only insults the memory of Thompson but also…"", 'As America shut down in March 2020, and federal officials struggled to get $$ to desperate health providers, Brian Thompson said UnitedHealth could do it asap — and they did.\n\nThe $135 billion fund helped keep countless providers afloat.\n\nThompson’s role has never been reported.', ""I guess little fella didn't learn. He constantly demonizes CEOs. Brian Thompson CEO of United Healthcare was MURDERED yesterday in NYC. Instead of giving it a rest little fella doubles down on disparaging another CEO. Looks like litter fella won't stop until all CEOs are murdered""]",unitedhealth - ceos - insurance - healthcare - insured - deaths - health - providers - tragic - company,False,12/4/2024 16:23,12/4/2024 16:23
LETS FUCKING GOOOOO,14,14_lets_gooooooooooo_gooooo_fucking,"['lets', 'gooooooooooo', 'gooooo', 'fucking', 'yes', 'please', 'fraser', '', '', '']","['Lets do this more often', 'LETS FUCKING GOOOOOOOOOOO', 'LETS FUCKING GOOOOO']",lets - gooooooooooo - gooooo - fucking - yes - please - fraser -  -  - ,True,12/4/2024 15:43,12/4/2024 15:43
"I’m my thoughts are with the entire family of . They’ve been in choice for health, dental, and vision for my entire adult life. They’ve been very good to me. Today’s deadly attack on Brian Thompson was likely targeted, media reports say. America’s healthcare is broken; people…",4,4_healthcare_father_shareholders_newsmax,"['healthcare', 'father', 'shareholders', 'newsmax', 'sympathy', 'family', 'lobbied', 'medical', 'robber', 'husband']","['I’m my thoughts are with the entire family of . They’ve been in choice for health, dental, and vision for my entire adult life. They’ve been very good to me. Today’s deadly attack on Brian Thompson was likely targeted, media reports say. America’s healthcare is broken; people…', 'United Healthcare CEO Brian Thompson was a father, husband, and just 50 years old when he was murdered. He leaves behind his wife and young kids. Anyone celebrating his murder because of his chosen career path, is a truly terrible person.', 'First off, Brian Thompson was not some robber baron, he was a father and husband, he came from nothing, went to a state school, and started at UHC as a manager. It’s tough to go from manager to CEO but from all first hand accounts I’ve heard from people in the industry, he was a…']",healthcare - father - shareholders - newsmax - sympathy - family - lobbied - medical - robber - husband,True,12/4/2024 15:40,12/4/2024 15:40
As someone covered under UnitedHealthCare i can completely understand the actions taken,3,3_unitedhealthcareinc_healthinsurance_unitedhealthgroupincorporated_healthcare,"['unitedhealthcareinc', 'healthinsurance', 'unitedhealthgroupincorporated', 'healthcare', 'medicare', 'insurance', 'hospitals', 'enrollment', 'enrolled', 'tricare']","['Thinking about health insurance? UnitedHealthcare (#UnitedHealthcareInc, #UnitedHealthGroupIncorporated) offers a wide range of plans. Compare options & find the best fit for your needs! Learn more: [link to website] #UnitedHealthcareInc,Unite', 'UnitedHealthcare (UHC) offers a food benefit that provides a monthly credit to help pay for healthy food and over-the-counter (OTC) products. The credit is loaded onto a UCard, which can be used at participating stores or online.', ""Looking for a Medicare plan that meets your needs and budget? I can help. I'm a licensed sales agent for UnitedHealthcare Medicare Advantage plans based in FL. Call me at 727-688-9125 , TTY 711.\n\nWe only have a fews days left of Open Enrollment. Contact me soon!""]",unitedhealthcareinc - healthinsurance - unitedhealthgroupincorporated - healthcare - medicare - insurance - hospitals - enrollment - enrolled - tricare,False,12/4/2024 15:15,12/4/2024 15:15
"Crazy what the Loonies have pushed America to

United health is 
- $500 B MC
- $370 B revenues 
- Part of Dow 30
- more importantly part of my core portfolio

& they shot their CEO Dead today morning",8,8_healthcareforall_insurance_health_billionaire,"['healthcareforall', 'insurance', 'health', 'billionaire', 'hospital', 'malpractice', 'revenues', 'medicine', 'surgeries', 'premiums']","['My mom has cancer and UnitedHealthcare paid about 1.8 million dollars of her hospital bills. The chemo, medicine, surgeries, etc were all paid for. So tell me, did you have a personal experience or are you just going off of what you see on the internet?', 'Crazy what the Loonies have pushed America to\n\nUnited health is \n- $500 B MC\n- $370 B revenues \n- Part of Dow 30\n- more importantly part of my core portfolio\n\n& they shot their CEO Dead today morning', 'Under CEO Brian Thompson, UnitedHealthcare has expanded access to healthcare for millions, focusing on community health, affordability, and innovation. His leadership continues to drive positive change for underserved populations. #HealthcareForAll #CommunityImpact #Leadership']",healthcareforall - insurance - health - billionaire - hospital - malpractice - revenues - medicine - surgeries - premiums,True,12/4/2024 14:20,12/4/2024 14:20
