ID,Url,original_text,gpt-4.1-mini_stance,Date,Topic
21729,http://twitter.com/charmain7250681/statuses/1867725655871565986,"Even if you don't think the killing was justified, viewing Brian Thompson negatively is absolutely sick. No one has yet pointed to a single unethical or untoward decision he personally made.",1,12/14/2024 0:17,11
21851,http://twitter.com/JoeHuxley666/statuses/1867712940390174740,"I am a big fan but gotta say, America This Week discussion with  on the Mangione shooting was overly-histrionic and way longer than it needed to be.",1,12/13/2024 23:27,13
21882,http://twitter.com/Priya_Shah1/statuses/1867708849228251488,What a pathetic tweet from a professor at Columbia which charges students heavy tuition fees. Brian Thompson clearly came from a humble beginning and worked his way up. Disgusting.,1,12/13/2024 23:11,10
22109,http://twitter.com/realdorcw/statuses/1867685595721662798,"A leftist with TDS tells the truth about single-payer. Get back on a plane to the States. And that socialist POS Mangione was not even a UH customer, what a surprise.",1,12/13/2024 21:38,13
22228,http://twitter.com/mad_muppet/statuses/1867674153475817775,"“Nothing justifies what the shooter did, but he was way more justified than you. Please consider your privilege and do not contemplate any copycat events! Leave Healthcare CEOs alone and stay in your lane in solidarity! Thank you!”

 via @",1,12/13/2024 20:53,5
22289,http://twitter.com/Highdiver24/statuses/1867667722412187697,"You are a very sad but typical liberal who blames the victims and will not hold the perpetrator accountable! You think the CEO of United Healthcare, who grew up in a middle to poor class family and made himself what he was today unlike the privileged murderer Luigi, had it coming…",1,12/13/2024 20:27,18
22384,http://twitter.com/RightAngleView/statuses/1867659986148737390,"Amen! It’s sickening to see people glorifying the cold-blooded killing of Brian Thompson—a man who embodied the American dream. If you’re upset with the healthcare system, work to change it. Stop celebrating a madman.",1,12/13/2024 19:56,15
23104,http://twitter.com/VucciMane69/statuses/1867599413788459072,"""Brian Thompson is the real working-class hero""",1,12/13/2024 15:56,4
23229,http://twitter.com/todaystropics/statuses/1867584341175332922,"You’re so misguided if you believe what you’re saying. The guy was a cpa, the ultimate middle class job. UnitedHealthcare insurance is required to pay out 85% of premiums received as claims. And they do. Learn something instead of being indoctrinated",1,12/13/2024 14:56,2
23604,http://twitter.com/MichaelRCaputo/statuses/1867533136302944330,". is a propagandist trying to convince you that violence against a business leader is normalized. 

It’s not. That’s socialist dogma. Mangione is a murdering nutjob who Ali admires for his violence against capitalism.",1,12/13/2024 11:32,13
24199,http://twitter.com/fewgoodpoints/statuses/1867414608358654167,"There’s an underlying envy of Brian Thompson. The hate comes from the fact that he achieved something many working-class people aspire to. His success makes critics feel inadequate, and that angers them. At the end of the day, it’s envy—and envy is corrosive to the mind.",1,12/13/2024 3:41,4
24226,http://twitter.com/Rhomulen/statuses/1867411749173113256,For Elizabeth Warren to act like the killing of UnitedHealthcare CEO Brian Thompson is warranted or understandable behavior is heinous.,1,12/13/2024 3:30,9
24232,http://twitter.com/KeithWo4418/statuses/1867411209818914898,Luigi didn't even have a denied claim. This woman's insane. There is no justification for this violence against insurance companies.,1,12/13/2024 3:28,8
24245,http://twitter.com/JJWidmann1/statuses/1867409319811330520,They fixed my back,1,12/13/2024 3:20,16
24338,http://twitter.com/stinchfield1776/statuses/1867400562217472022,“THIS IS THE KIND OF SICK BEHAVIOR FROM THE LEFT THAT SHOULD MAKE EVERYONE’S SKIN CRAWL.”  blasts liberals for justifying the murder of UnitedHealthcare CEO! “You don’t go murder a person!”,1,12/13/2024 2:46,5
25128,http://twitter.com/creekchick65/statuses/1867332746705883586,so ur saying it was OK for mangione to kill the United health care? It is NOT AN ACT OF VIOLENCE to be denied a claim for insurance. U r the BIGGEST IDIOT WE HV N Washington. It's NOT ok to kill someone over insurance. GROW UP & DEAL W LIFE. WHAT A FREAKING IMBECILE,1,12/12/2024 22:16,18
25465,http://twitter.com/TaiwanOrwell/statuses/1867305983896121532,"Brian Thompson was an innocent person, you scumbag  
You should be ashamed of yourself.",1,12/12/2024 20:30,14
25498,http://twitter.com/SARA2001NOOR/statuses/1867303470232899604,LUIGI YOU GAVE US HOPE,1,12/12/2024 20:20,3
25507,http://twitter.com/AleksBathory/statuses/1867302738406547569,"he was a brave CEO who came from nothing and improved healthcare for all americans. and in this house Brian Thompson is a hero, end of story",1,12/12/2024 20:17,15
25605,http://twitter.com/JoshTheBoi4/statuses/1867294476042899619,Luigi took this thug off the street before he could harm anyone else,1,12/12/2024 19:44,1
25693,http://twitter.com/_NavyBrat/statuses/1867286879462105535,"Over the last few days, I've been watching the Left and Left MSM celebrating Luigi Mangione murdering UnitedHealthcare’s CEO, Brian Thompson. It is disgusting. It's also not a surprise since the Left love celebrating violence.

There's something more going on with them…",1,12/12/2024 19:14,13
25707,http://twitter.com/Mr_Buckworth/statuses/1867285855314096474,congrats on your promotion to CEO of UnitedHealthcare snellszn! you sure got some big shoes to fill!,1,12/12/2024 19:10,2
25846,http://twitter.com/IsraelsBestie/statuses/1867275536286068784,"LUIGI MANGIONE is a dumb loser who murdered #UnitedHealthcare CEO Brian Thompson because he hurt his tard back due to sucking at surfing. He also eats McDonalds, is a weak drug addict and listens to Taylor Swift because he's a tard! #MAGA #FreeLuigi #IstandWithUnitedHealthcare",1,12/12/2024 18:29,6
26059,http://twitter.com/Dr_Pwrnerd5000/statuses/1867260267618287633,Luigi the Patron Saint of Healthcare!,1,12/12/2024 17:28,8
26219,http://twitter.com/DanOvercast/statuses/1867249100728758484,United Healthcare should pony up. It would help them with normal people AND troll the commies that think Luigi is Robin Hood.,1,12/12/2024 16:44,16
26425,http://twitter.com/SHHLONGBERG/statuses/1867236322152517645,"Under CEO Brian Thompson, UnitedHealthcare has expanded access to healthcare for millions, focusing on community health, affordability, and innovation. His leadership continues to drive positive change for underserved populations. #HealthcareForAll #CommunityImpact #Leadership",1,12/12/2024 15:53,17
26540,http://twitter.com/Hobbie_VK/statuses/1867227309725581419,It's far more compassionate than denying someone healthcare to protect your profits. #UnitedHealthcare,1,12/12/2024 15:17,2
26867,http://twitter.com/GlennFischer8/statuses/1867199942378332316,Elizabeth Warren made comments that encourage violence against the health care industry. How horrible! The senate should censure her and her constituents must vote her out of office. To justify the cold blooded murder of a Health Care CEO is reckless. Brian Thompson was murdered!,1,12/12/2024 13:28,7
27015,http://twitter.com/BuccStone/statuses/1867185401238016043,"Brian Thompson never lobbied any politicians for those purposes, and you have no evidence that he did. It's all your own conjecture. He worked there for 20 years and climbed the corporate ladder to expose corruption. There is clear evidence of that.",1,12/12/2024 12:31,10
27495,http://twitter.com/yhmzotf/statuses/1867108162090025289,"Got a new job and I get benefits imma make this money then use those benefits to have the surgery on my knees that I’ve needed for years 😭 been walking around with a torn LCL, ACL, meniscus, patellar tendon, and broken foot for 2 years I’m so happy rn ily Luigi.",1,12/12/2024 7:24,16
27938,http://twitter.com/NebraskaNice83/statuses/1867056541657895019,"Anyone, and I mean anyone celebrating the tragic end of Brian Thompson is a hypocrite, a cancer on society, or both. Yes, they need prayer, although they probably also need the kind of corrective discipline their parents likely were too liberated to afford them the benefit of…",1,12/12/2024 3:59,14
28112,http://twitter.com/_twenty47_/statuses/1867042915702411444,"#GROK summary:

Piers Morgan loses it on air as Dem commentator says she has ZERO empathy for murdered #UnitedHealthcare CEO because 'healthcare system bad'. But what about empathy for the man, his family? 🤯 #PiersMorganUncensored #LuigiMangioni",1,12/12/2024 3:04,18
28469,http://twitter.com/AleXXXandria96/statuses/1867018631621571060,"Melissa Barrera standing up for what’s right again and again.
#UnitedHealthcare",1,12/12/2024 1:28,0
28567,http://twitter.com/ObitaWalker/statuses/1867011738828234904,"Won’t delete this.

Brian Thompson, UHC CEO, was a winner. Everyone has a death. His family will live in wealth centuries after his.

Can’t say the same of socialist vermin who lose their healthcare 😢.

They’re losers whose deaths will cleanse the earth of their filthy presence.",1,12/12/2024 1:01,12
28600,http://twitter.com/nrs_ratched/statuses/1867009122668835152,"Let’s be honest: The people celebrating the cold blooded murder of Brian Thompson are the ones that suffer from a deranged level of greed & jealousy; they see him as a worthless & expendable object simply because he was wealthy and they aren’t.

Brian Thompson, as CEO, wasn’t the…",1,12/12/2024 0:50,10
28620,http://twitter.com/jmewmogman/statuses/1867008152190980412,"Brian is a tragic hero. His work and company make people live longer but if you're not a systems thinker you won't see it. 

Best guess the percent population that is celebrating and Luigi and hating on Brian? 

I have to imagine less than 5%? Sort of like direct overlap with the…",1,12/12/2024 0:46,1
28723,http://twitter.com/DEllena4RI/statuses/1867001900471640336,This is the American dream not some little shit that killed a guy for doing his job. Brian Thompson didn’t deserve to die and luigi mangione is a monster and a killer.,1,12/12/2024 0:21,6
28741,http://twitter.com/LanceB71439/statuses/1867000613239918818,Senator Warren your response to the killing of Brian Thompson is inexcusable. The man was a husband and father. Just because you have a beef with corporate America does not allow you to make comments which seemingly excuse violence. Disgusting!,1,12/12/2024 0:16,11
28827,http://twitter.com/UnpopularBlargh/statuses/1866994988154052849,He's literally wrong. Especially in the case with UHC.,1,12/11/2024 23:54,18
28970,http://twitter.com/CitrusSmke/statuses/1866985715159933011,"What's y'all stance on the Luigi Mangione murder case of the CEO of United healthcare?? 
I just read his manifesto and that man is a martyr for all of us!",1,12/11/2024 23:17,13
29588,http://twitter.com/Gibson5972/statuses/1866956892028702983,"When a United States Senator  accepts as understandable the murder of a man just because he works in healthcare, we know America is not electing its best. This is a reprehensible view.",1,12/11/2024 21:23,7
29609,http://twitter.com/cleanbowled670/statuses/1866956118620319861,Brian Thompson was a chad actual middle class dude who earned generational wealth wealth for his wife and kids. Can’t say the same for the socialists celebrating his death who might lose their healthcare and will see their precious Gaza turn to rubble,1,12/11/2024 21:19,10
29914,http://twitter.com/CamGFunny/statuses/1866941183630643455,They made me feel so safe at the Doctors office today… wonder if it had to do anything with that Luigi guy,1,12/11/2024 20:20,8
29994,http://twitter.com/joelpollak/statuses/1866937343762223226,It’s atrocious that anyone is defending the murder of the UnitedHealthcare CEO as some kind of blow against private health insurance. Government-designed insurance under Obamacare has been a disaster—higher costs for worse outcomes and less access to care.,1,12/11/2024 20:05,9
30064,http://twitter.com/jcoff574/statuses/1866933661855260949,"WOW — Elizabeth Warren appears to condone the cold-blooded murder of UnitedHealthcare CEO Brian Thompson: 

""You can only push people so far and then they start to take matters into their own hands.""",1,12/11/2024 19:50,9
30919,http://twitter.com/pig_return/statuses/1866300545876529530,A useless bum called Luigi Mangione shot dead Brian Thompson who was one of the greatest CEOs to have ever been born. Rot in HELL Mangione.,1,12/10/2024 1:54,6
31062,http://twitter.com/georgegotpicks/statuses/1866297073836105945,"Luigi Mangione was anti-capitalist 

The fucking moron doesn’t like the idea of hard work = money 

So he takes it out on a multi millionaire ceo 

On top of all that, 5 days after committing the murder he was still in possession of the weapon

That checks out.",1,12/10/2024 1:41,6
31484,http://twitter.com/LeDogRules/statuses/1866288677284188547,Lorenz is a heartless ghoul. This coward shot this Brian Thompson in the back for no reason. Ice water runs through his veins. I hope Thompson's family sues Lorenz and demand a retraction for her accusation that Brian killed 10s of thousands of people. She's full of shit. More…,1,12/10/2024 1:07,11
31669,http://twitter.com/BoilerUpB1G/statuses/1866285130756640842,I know Luigi would disagree but this is infinitely better than universal healthcare.,1,12/10/2024 0:53,16
32149,http://twitter.com/AlexBerenson/statuses/1866277310522851354,"Obviously, there's a ton we do not know about the Unitedhealthcare (alleged) shooter.

What we do know already: all those progressives who cheered it and hoped - yes, hoped - it would be a ""justified"" killing, a denied care tit-for-tat, have humiliated themselves yet again.",1,12/10/2024 0:22,5
32961,http://twitter.com/jorgitopinzon_/statuses/1866263043690168777,Luigi mangione the man that you are!,1,12/9/2024 23:25,3
33525,http://twitter.com/SuccMyDrift/statuses/1866253393372512395,Laugh all yall want but Luigi just saved thousands if not MILLIONS of lives 🫡🫡🫡,1,12/9/2024 22:47,3
34334,http://twitter.com/ohiophinfan1037/statuses/1864764641965990066,"Taylor Lorenz is still celebrating the m*rder of UnitedHealthcare CEO. 

He has a wife who lost her husband. He has children who just lost their father.

This is straight up evil and unhinged.",1,12/5/2024 20:11,18
34778,http://twitter.com/ojouirl/statuses/1864448638979854646,"Even though it’s no longer perfect, United Healthcare CEO Brian Thompson’s final KD ratio (7,652,103:1) lands him among the all time greats",1,12/4/2024 23:16,12
34805,http://twitter.com/CoolKat98330094/statuses/1864427833616920815,This nut is celebrating the murder of United Healthcare CEO Brian Thompson. These people are sick!,1,12/4/2024 21:53,7
34834,http://twitter.com/PawsNeedClaws/statuses/1864413800645935328,"DISGUSTING: Fat left activists are posting videos celebrating the killing of United Healthcare CEO Brian Thompson and describing the murderer as a “hero.”

These same freaks are the ones who say genocide when countries go after terrorists.",1,12/4/2024 20:57,7
35403,http://twitter.com/WilliamJKelleh1/statuses/1870951175501312114,Saint Luigi of Mangione - He sacrificed his freedom to make our health care better,1,12/22/2024 21:54,8
35824,http://twitter.com/AndersKomi/statuses/1870873780513571218,Maybe billionaires want him dead. The man is like a fucking messiah. People have made T-shirts and memorabilia. He’s already made history. Luigi started a movement that they are trying desperately to contain and they’re failing.,1,12/22/2024 16:47,1
35967,http://twitter.com/LionessAriel/statuses/1870848177882141068,Luigi definitely saved his life. This post would not have the impressions without Luigi and UHC wouldn’t have cared without Luigi.,1,12/22/2024 15:05,1
35971,http://twitter.com/HaroldPeckNYC/statuses/1870847204824400072,I also don’t want to hang out with you if you think the UnitedHealthcare CEO murder was a good thing. And you celebrate the murderer.,1,12/22/2024 15:01,5
36239,http://twitter.com/ScottZPinkRose/statuses/1870747834498121825,Blue Cross Blue Shield literally reversed course on a policy change that would have killed millions within hours of news of the shooting getting out. That's better results than you most often hear. More Luigi's are needed.,1,12/22/2024 8:26,1
36427,http://twitter.com/JJJddd1234567/statuses/1870681476997788152,"After shots, lots ppl’s insurance request got approved right away. Luigi saved their life.",1,12/22/2024 4:03,8
36528,http://twitter.com/nametenbooks/statuses/1870654993097015779,Brian Thompson's a bear 🫶🏳️‍🌈🫃,1,12/22/2024 2:18,4
36646,http://twitter.com/LazyDimi/statuses/1870623065786442224,"Don’t go with that company then😂 almost every ceo has done evil things to better their company. That’s how the world works. You weirdos who are gagging for this murderer are so weird. If Luigi looked like you, no one would give a shit and the story would be forgotten after a day",1,12/22/2024 0:11,1
36764,http://twitter.com/PatrickDuty1/statuses/1870596499660472744,"Every time John gets close to becoming an actual Leftist he winds up making some stupid shitlib statement like this Luigi remark. 😅 You call him a killer, I call him a creative problem solver. 😂",1,12/21/2024 22:25,1
36923,http://twitter.com/iamtig1/statuses/1870565599241216113,luigi didn't miss 💪,1,12/21/2024 20:22,3
37089,http://twitter.com/Serega676z/statuses/1870539151143023057,"CNN political commentator  on the left supporting the assassination of UnitedHealthcare CEO Brian Thompson:

""They want to justify violence to change a system they don't like.""",1,12/21/2024 18:37,7
37220,http://twitter.com/speckledtadpole/statuses/1870513060118720600,"Where is the next board of directors meeting? Maybe ask one in person, I think Luigi saw some great results…",1,12/21/2024 16:54,1
37518,http://twitter.com/JayneEdwards2/statuses/1870462777208230116,Muskrat proving how he supports US healthcare insurance companies. He's yer average Brian Thompson kind of guy.,1,12/21/2024 13:34,15
38086,http://twitter.com/Anderso62728581/statuses/1870298139254542554,Luigi Mangione is a criminal terrorist. He killed a ceo not just for revenge but in the hopes that it would stir political change. Brian is what any ceo is supposed to do: maximize profits. A ceo who doesn't do this is fired. Killing ceos (who are ppl) does nothing.,1,12/21/2024 2:39,6
38140,http://twitter.com/EliMcLeod9/statuses/1870290020860391710,He was there helping his fellow Americans. While Luigi on the other hand killed a man in cold blood. I see a lot of differences. To all of you saying that Kyle is a murderer go fuck yourself. Next time a person pulls a gun on you let's see how you act.,1,12/21/2024 2:07,1
38455,http://twitter.com/mynameissteves/statuses/1870241184876245370,Flo from progressive is aging like a president. That boy Luigi really changed the insurance game top to bottom,1,12/20/2024 22:53,1
38689,http://twitter.com/Milan5675089298/statuses/1870209423177601239,DEFINITELY SOME LUIGI! ❤️,1,12/20/2024 20:47,3
38984,http://twitter.com/GORGO4547/statuses/1870179530549190753,Where is your SYMPATHY POST FOR UHC CEO BRIAN THOMPSON??,1,12/20/2024 18:48,10
39323,http://twitter.com/shaggydoo184575/statuses/1870146250315837502,"Thompson safeguarded over 8,000,000 members. His company saved the lives of many. The Coward Luigi, who shot another man in his back, will rot having accomplished nothing. His skin will be sallow. He leaves neither care nor riches for his family. He is less than nothing.",1,12/20/2024 16:36,6
39537,http://twitter.com/Jill2BetsyT/statuses/1870128931678105754,Brian Thompson was one of the many CEOs of the departments below you have to understand that. the media never looks into anything and they deliberately on purpose lie to you. the CEO of United healthcare was knighted by Queen Elizabeth!!!,1,12/20/2024 15:27,12
39947,http://twitter.com/LibertySoaring/statuses/1870087761027301662,"Just as they couldn’t find Israel on a map, yet protested for its elimination, these ⁦⁩ pinheads haven’t a clue how health insurance works, yet they justify a murder of an insurance executive by claiming the system isn’t fair.",1,12/20/2024 12:44,9
40262,http://twitter.com/JasonTheWan/statuses/1870029684777570746,"Finish the job, Luigi",1,12/20/2024 8:53,3
40959,http://twitter.com/neerajadeshp/statuses/1869943437820145785,It's like the leftists who simultaneously want all prisons abolished while somehow believing that the UnitedHealthcare CEO was a criminal who deserved to be murdered in the street.,1,12/20/2024 3:10,5
41559,http://twitter.com/PaulFreid5/statuses/1869903162611572957,"Luigi Mangione for Speaker! 

He’ll fix our health care.",1,12/20/2024 0:30,8
41655,http://twitter.com/_Vanderr_/statuses/1869896431495967067,no vest on him because no one would dare shoot our hero Luigi 💜,1,12/20/2024 0:03,3
41858,http://twitter.com/JournoPig/statuses/1869881220978335828,I’m standing up for Brian Thompson fuckface.,1,12/19/2024 23:03,4
41871,http://twitter.com/Sqilluy/statuses/1873232285920838017,"Allegedly, it'd actually be better if more CEOs followed in United Healthcare CEO Brian Thompson's footsteps.",1,12/29/2024 4:59,12
42079,http://twitter.com/UnacceptNorms/statuses/1873142686527701044,Ignorant? Luigi is courageous enough to take a stand for all those who have been denied access to care. What have you done to address this injustice? We need to recognize him not only as a hero but as someone making a meaningful difference for humanity.,1,12/28/2024 23:03,1
43115,http://twitter.com/CaseSkywalker/statuses/1872721596340945379,Right on,1,12/27/2024 19:09,19
43424,http://twitter.com/demarcusAldrid2/statuses/1872599441737494581,Luigi wip I'm actually super happy with,1,12/27/2024 11:04,3
43955,http://twitter.com/AleyckTW/statuses/1872376596407230712,You think prisoners would be chomping at the bit to murder a man who slayed a monster like Brian Thompson?,1,12/26/2024 20:19,11
44133,http://twitter.com/RobertJThomas1/statuses/1872323903802241120,"ABSOLUTELY DISGUSTING!

First we had people publicly supporting Luigi Mangione, who brutally executed United Healthcare CEO Brian Thompson. NOW we have people making mock videos of the murder, as if the death is somehow funny. This was someone's father, brother, friend. And yet…",1,12/26/2024 16:49,13
44563,http://twitter.com/KajitaniMike/statuses/1872123831084896371,UnitedHealthcare has saved my husband’s life 3x..not one procedure denied..,1,12/26/2024 3:34,2
45070,http://twitter.com/MR2528015154180/statuses/1871983325172125996,"🖕 Luigi and his family, he's a cowardly murderer who murdered an upper class man in cold blood in broad daylight, as for denying claims, I don't care, if your insurance company sucks go somewhere else instead of murdering the upper class",1,12/25/2024 18:16,1
45076,http://twitter.com/Colej1977/statuses/1871982841489473800,This is a prime example of the good of  buying X. Would this have came out prior to him buying X? Good on this woman coming forward and exposing UnitedHealthcare.,1,12/25/2024 18:14,9
45192,http://twitter.com/SteinmanRuth/statuses/1871950939130875959,"Luigi in jail for Christmas, but he is the one suffering now, and he does not have United healthcare.",1,12/25/2024 16:07,8
45251,http://twitter.com/johnzee451/statuses/1871938822000504914,What I hear about Brian Thompson is nothing like what you make him out to be. From people that actually know him I hear he was a good guy working to improve United Healthcare.,1,12/25/2024 15:19,15
45581,http://twitter.com/caboosesix/statuses/1871829527481160077,"A CEO that never sees the people that get claims denied can't be defined as a murderer. Brian Thompson didn't go to work each day with a ""how many people can I intentionally kill today"" mindset and for you to malign him as such is disgusting. Idolizing his killer even more so.",1,12/25/2024 8:05,10
45998,http://twitter.com/MarcDamon9/statuses/1871730263274987771,The classic progressive thought on this is that Brian Thompson created an environment of nihilism and crime thus he deserved to be shot due to the conditions he created. This thought process is also bats$&% insane.,1,12/25/2024 1:30,11
46144,http://twitter.com/rathkillon/statuses/1871705631088160852,"Did he tell his followers to do so? Seriously, man. Brian Thompson and Bin Laden are in no way equals. One really was a mass murder and one actually saved millions.",1,12/24/2024 23:52,11
46181,http://twitter.com/KeyLushis/statuses/1871700117843329514,A lot of people are going home to their family this Christmas because of the higher percentage of claim approvals that Luigi caused.,1,12/24/2024 23:30,1
46250,http://twitter.com/MattAAW/statuses/1871686940048986252,"What would we be defending the CEO about? 

Brian Thompson was a great man who contributed to thousands of jobs and 100s of millions of dollars to help people get medical care.",1,12/24/2024 22:38,12
46335,http://twitter.com/astronomy89/statuses/1871672659815354855,You’re an unaccomplished nobody filled with hate and envy. Brian Thompson was a far better person than you ever were.,1,12/24/2024 21:41,4
46381,http://twitter.com/OGGhostly33/statuses/1871664984910082154,Brian Thompson was replaced the same day you absolute brain dead moron. If you don't like the fact that america is the only place where you are guaranteed Healthcare whether you can pay for it or not by all means leave this fucking country commie bastard,1,12/24/2024 21:11,15
47160,http://twitter.com/Swagner28/statuses/1871564907340271956,BrIaN tHoMpSoN iS tHe ReAl HeRo,1,12/24/2024 14:33,4
